{
  "schema_version": "1.0.0",
  "device_id": "20000000-0000-4000-8000-000000000004",
  "agent_id": "20000000-0000-4000-8000-000000000005",
  "protocol_version": "1.0.0",
  "server_received_at": "2026-07-12T12:00:01Z",
  "credential": {
    "schema_version": "1.0.0",
    "credential_id": "10000000-0000-4000-8000-000000000001",
    "credential_version": 1,
    "credential": "wto_ac_1.10000000-0000-4000-8000-000000000001.AAAAAAAAAAAAAAAAAAAAAAAAAAAAAAAAAAAAAAAAAAA",
    "issued_at": "2026-07-12T12:00:01Z",
    "expires_at": "2026-10-10T12:00:01Z",
    "state": "active"
  }
}
